variable_name,label,field,source,link,start_column,end_column,start_date,end_date,filename_in_release4,footnote
cdc_vac_dose1_65plus_yyyymmdd,# of people ages 65 plus with at least one dose on yyyymmdd,vaccination,CDC,https://data.cdc.gov/Vaccinations/COVID-19-Vaccinations-in-the-United-States-Jurisdi/unsk-b7fc,11621,12009,20210213,20220308,,
apm_vac_all_population,Census count of All persons in the state,vaccination,Census,https://www.census.gov/newsroom/press-kits/2020/population-estimates-detailed.html,12010,12010,-1,-1,,
apm_vac_black_population,Census count of Black persons in the state,vaccination,Census,https://www.census.gov/newsroom/press-kits/2020/population-estimates-detailed.html,12011,12011,-1,-1,,
apm_vac_white_population,Census count of White persons in the state,vaccination,Census,https://www.census.gov/newsroom/press-kits/2020/population-estimates-detailed.html,12012,12012,-1,-1,,
apm_vac_asian_population,Census count of Asian persons in the state,vaccination,Census,https://www.census.gov/newsroom/press-kits/2020/population-estimates-detailed.html,12013,12013,-1,-1,,
apm_vac_latino_population,Census count of Latino persons in the state,vaccination,Census,https://www.census.gov/newsroom/press-kits/2020/population-estimates-detailed.html,12014,12014,-1,-1,,
apm_vac_indig_population,Census count of Indigenous persons in the state,vaccination,Census,https://www.census.gov/newsroom/press-kits/2020/population-estimates-detailed.html,12015,12015,-1,-1,,
apm_vac_other_population,Census count of other race/ethnicity persons in the state,vaccination,Census,https://www.census.gov/newsroom/press-kits/2020/population-estimates-detailed.html,12016,12016,-1,-1,,
apm_vac_all_yyyymmdd,Number of All persons vaccinated,vaccination,APM,https://www.apmresearchlab.org/covid/vaccines-by-race,12017,12020,20210405,20210517,,
apm_vac_black_yyyymmdd,Number of Black persons vaccinated,vaccination,APM,https://www.apmresearchlab.org/covid/vaccines-by-race,12021,12024,20210405,20210517,,
apm_vac_white_yyyymmdd,Number of White persons vaccinated,vaccination,APM,https://www.apmresearchlab.org/covid/vaccines-by-race,12025,12028,20210405,20210517,,
apm_vac_asian_yyyymmdd,Number of Asian persons vaccinated,vaccination,APM,https://www.apmresearchlab.org/covid/vaccines-by-race,12029,12032,20210405,20210517,,
apm_vac_latino_yyyymmdd,Number of Latino persons vaccinated,vaccination,APM,https://www.apmresearchlab.org/covid/vaccines-by-race,12033,12036,20210405,20210517,,
apm_vac_indig_yyyymmdd,Number of Indigenous persons vaccinated,vaccination,APM,https://www.apmresearchlab.org/covid/vaccines-by-race,12037,12040,20210405,20210517,,
apm_vac_other_yyyymmdd,Number of other race/ethnicity persons vaccinated,vaccination,APM,https://www.apmresearchlab.org/covid/vaccines-by-race,12041,12044,20210405,20210517,,
